<?xml version="1.0" encoding="UTF-8"?>
<!--
  Transaction : LstDisposal
  Program     : FAZ145MI
  Description : Return a list of fixed-asset disposal records that
                match the supplied filter criteria.  Supports
                open-ended filtering: all filters are optional.

  Business Rules
  ──────────────
  1. When ASID is supplied only disposals for that asset are returned.
  2. DISP / DSPF form an inclusive date range (YYYYMMDD).
     - If only DISP is supplied, records from that date onward are returned.
     - If only DSPF is supplied, records up to that date are returned.
  3. DSCD filters by disposal code.
  4. STAT filters by record status.
  5. Results are ordered by ASID ASC, SBNO ASC by default.
  6. A maximum of 1 000 rows is returned per call.
-->
<Transaction
    xmlns:xsi="http://www.w3.org/2001/XMLSchema-instance"
    xsi:noNamespaceSchemaLocation="../../schema/Transaction.xsd"
    program="FAZ145MI"
    name="LstDisposal"
    description="List fixed-asset disposal records"
    type="List">

  <!-- ── Input ──────────────────────────────────────────────────── -->
  <InputParameters>
    <Parameter field="CONO" description="Company Number"
        type="Numeric" length="3" mandatory="false"
        remarks="Defaults to the user's current company when blank."/>
    <Parameter field="ASID" description="Fixed Asset ID Filter"
        type="String" length="10" mandatory="false"
        remarks="Partial match supported (prefix). Leave blank for all assets."/>
    <Parameter field="DISP" description="Disposal Date From (YYYYMMDD)"
        type="Numeric" length="8" mandatory="false"
        remarks="Lower boundary of the date range (inclusive)."/>
    <Parameter field="DSPF" description="Disposal Date To   (YYYYMMDD)"
        type="Numeric" length="8" mandatory="false"
        remarks="Upper boundary of the date range (inclusive)."/>
    <Parameter field="DSCD" description="Disposal Code Filter"
        type="String" length="2" mandatory="false"
        remarks="Exact match. Leave blank to include all disposal codes."/>
    <Parameter field="STAT" description="Status Filter"
        type="String" length="2" mandatory="false"
        remarks="Exact match. Valid values: 20 (Pending), 60 (Disposed), 90 (Reversed)."/>
  </InputParameters>

  <!-- ── Output ─────────────────────────────────────────────────── -->
  <OutputParameters>
    <Parameter field="CONO" description="Company Number"       type="Numeric" length="3"/>
    <Parameter field="ASID" description="Fixed Asset ID"       type="String"  length="10"/>
    <Parameter field="SBNO" description="Sub-number"           type="Numeric" length="3"/>
    <Parameter field="DISP" description="Disposal Date"        type="Numeric" length="8"/>
    <Parameter field="DSCD" description="Disposal Code"        type="String"  length="2"/>
    <Parameter field="DIPR" description="Disposal Proceeds"    type="Numeric" length="17"/>
    <Parameter field="DICU" description="Disposal Currency"    type="String"  length="3"/>
    <Parameter field="RESP" description="Responsible Employee" type="String"  length="10"/>
    <Parameter field="DEPT" description="Department"           type="String"  length="8"/>
    <Parameter field="STAT" description="Status"               type="String"  length="2"/>
  </OutputParameters>

  <!-- ── Error Codes ────────────────────────────────────────────── -->
  <ErrorCodes>
    <ErrorCode code="WF03001" description="Disposal Date From {DISP} is after Disposal Date To {DSPF}."/>
  </ErrorCodes>

</Transaction>
